{
  "schema_version": "1.0",
  "nodes": 5,
  "name": "mesh5",
  "links": [
    {
      "from": 0,
      "to": 1,
      "delay": 5,
      "bandwidth": 100,
      "loss": 0.5
    },
    {
      "from": 1,
      "to": 2,
      "delay": 10,
      "bandwidth": 100,
      "loss": 0.02
    },
    {
      "from": 2,
      "to": 3,
      "delay": 8,
      "bandwidth": 100,
      "loss": 0.015
    },
    {
      "from": 3,
      "to": 4,
      "delay": 6,
      "bandwidth": 100,
      "loss": 0.005
    },
    {
      "from": 4,
      "to": 0,
      "delay": 20,
      "bandwidth": 50,
      "loss": 0.03
    }
  ]
}
